{
  "latest_preview_or_rc": {
    "content_commit": "a8f5f0ab5bb96411142934c45a2b8ff0f0f9fc2f",
    "content_equivalent_to": null,
    "current_status": "release-candidate",
    "git_tag": "RC-2026.09.27-01",
    "issued_status": "release-candidate",
    "manifest_content_kind": "text",
    "manifest_hash_profile": "afwi-content-sha256-v1",
    "manifest_media_type": "application/json",
    "manifest_path": "rule-core/generated/releases/RC-2026.09.27-01-release-manifest-final.json",
    "manifest_sha256": "453c7196daddf09af131c853539fe01840521d33a9199735596c86778c758876",
    "release_id": "RC-2026.09.27-01",
    "supersedes": "RC-2026.09.26-01"
  },
  "latest_stable": null,
  "previous_releases": [
    {
      "content_commit": "cefaabf0596d11d04d643626583bd7c6a4a2bdb3",
      "content_equivalent_to": null,
      "current_status": "release-candidate",
      "git_tag": "RC-2026.09.26-01",
      "issued_status": "release-candidate",
      "manifest_content_kind": "text",
      "manifest_hash_profile": "afwi-content-sha256-v1",
      "manifest_media_type": "application/json",
      "manifest_path": "rule-core/generated/releases/RC-2026.09.26-01-release-manifest-final-candidate.json",
      "manifest_sha256": "5f83f5963a010a4dce4debf3599d504197a57c703ce24756b2840ac29590dd5e",
      "release_id": "RC-2026.09.26-01",
      "supersedes": null
    }
  ],
  "schema_version": "1.0.0",
  "status_records": [],
  "updated_at": "2026-09-27T00:00:00+09:00",
  "withdrawn": []
}
